{
  "schemaVersion": "v1",
  "promotionId": "promotion_trend_following_shadow",
  "subjectKind": "strategy",
  "subjectKey": "candidate_trend_following_jupiter_sol_usdc",
  "currentState": "draft",
  "targetState": "shadow",
  "transitionType": "promote",
  "status": "applied",
  "summary": "promote transition draft -> shadow was applied.",
  "requestedBy": "codex",
  "createdAt": "2026-03-12T00:00:00.000Z",
  "updatedAt": "2026-03-12T00:00:00.000Z",
  "appliedAt": "2026-03-12T00:00:00.000Z",
  "issueNumber": 322,
  "pullRequestNumber": 400,
  "deploymentId": "dep_candidate_trend_following_jupiter_sol_usdc_shadow",
  "policyGateId": "policygate_candidate_trend_following_jupiter_sol_usdc",
  "synthesisId": "synthesis_candidate_trend_following_jupiter_sol_usdc",
  "triageId": "triage_candidate_trend_following_jupiter_sol_usdc",
  "implementationReference": {
    "kind": "pull_request",
    "ref": "#400",
    "mergedAt": "2026-03-12T00:00:00.000Z"
  },
  "evidenceRefs": [
    {
      "kind": "synthesis",
      "ref": "synthesis_candidate_trend_following_jupiter_sol_usdc"
    },
    {
      "kind": "triage",
      "ref": "triage_candidate_trend_following_jupiter_sol_usdc"
    },
    {
      "kind": "policy_gate",
      "ref": "policygate_candidate_trend_following_jupiter_sol_usdc"
    },
    {
      "kind": "implementation_reference",
      "ref": "#400"
    }
  ],
  "checks": [
    {
      "checkId": "allowed-transition",
      "status": "pass",
      "observedValue": "draft->shadow",
      "thresholdValue": "supported",
      "message": "Transition is part of the strategy-lab strategy state machine."
    },
    {
      "checkId": "policy-gate",
      "status": "pass",
      "observedValue": "pass",
      "thresholdValue": "pass",
      "message": "Shadow policy gate passed."
    },
    {
      "checkId": "implementation-reference",
      "status": "pass",
      "observedValue": "#400",
      "thresholdValue": "present",
      "message": "Implementation reference is attached to the transition record."
    },
    {
      "checkId": "deployment-record",
      "status": "pass",
      "observedValue": "shadow:shadow",
      "thresholdValue": "shadow:shadow",
      "message": "Runtime deployment record is attached for apply-time orchestration."
    }
  ],
  "actions": [
    {
      "actionId": "record-state-transition",
      "actionType": "record_state_transition",
      "summary": "Persist the strategy-lab transition audit record.",
      "required": true,
      "payload": {
        "subjectKind": "strategy",
        "subjectKey": "candidate_trend_following_jupiter_sol_usdc",
        "currentState": "draft",
        "targetState": "shadow"
      }
    },
    {
      "actionId": "upsert-runtime-deployment",
      "actionType": "upsert_runtime_deployment",
      "summary": "Upsert the runtime deployment into the target execution mode.",
      "required": true,
      "payload": {
        "deployment": {
          "schemaVersion": "v1",
          "deploymentId": "dep_candidate_trend_following_jupiter_sol_usdc_shadow",
          "strategyKey": "candidate_trend_following_jupiter_sol_usdc",
          "sleeveId": "sleeve_alpha",
          "ownerUserId": "user_runtime_fixture",
          "venueKey": "jupiter",
          "pair": {
            "symbol": "SOL/USDC",
            "baseMint": "So11111111111111111111111111111111111111112",
            "quoteMint": "EPjFWdd5AufqSSqeM2qN1xzybapC8G4wEGGkZwyTDt1v",
            "marketType": "spot"
          },
          "mode": "shadow",
          "state": "shadow",
          "lane": "safe",
          "createdAt": "2026-03-12T00:00:00.000Z",
          "updatedAt": "2026-03-12T00:00:00.000Z",
          "policy": {
            "maxNotionalUsd": "25",
            "dailyLossLimitUsd": "10",
            "maxSlippageBps": 50,
            "maxConcurrentRuns": 1,
            "rebalanceToleranceBps": 100
          },
          "capital": {
            "allocatedUsd": "100",
            "reservedUsd": "5",
            "availableUsd": "95"
          },
          "tags": ["strategy-lab", "shadow"]
        }
      }
    }
  ],
  "approvals": [],
  "metadata": {
    "source": "strategy-lab"
  }
}
